I felt my shout had been very loud, louder than the roar of ocean waves, louder than the clap of thunderbolt that had stricken my heart asunder - but of course it mustn't have been as loud as all that.	ซึ่งผมรู้ สึกว่ามันดัง ลั่น ... ดัง ลั่น แข่งกับ เสียงครึกโครมของ คลื่นมหา สมุทร ดัง ลั่น แข่งกับ กัมปนาทของอสนีบาตที่ฟาด ขึ้นกลาง ใจ แท้ที่ จริง แล้ว ก็คง จะ ไม่ดัง เท่าไร
Mrs Bunlueang now faced me and was looking at me impassively.	คุณบุญเลื่องเหลียวมามองผม นิ่ง อยู่ ในอาการสงบ เย็น
Only her eyes and eyebrows registered some surprise, but not much, as if she had turned to see a squirrel gazing at her in some place where it wasn't supposed to be.	มีแต่นัยน์ตา และคิ้วของเธอ เท่านั้น ที่ ไหว ให้ เห็น ถึง ความพิลึก ใจ ได้ไรๆ แต่ ก็พิลึก แค่ เหมือนเหลียวมา เห็นกระรอกกระแตมาเบิ่ง อยู่ ในที่ที่ ไม่น่า จะมา อยู่
"What did you call me just now?	"เมื่อกี้เธอเรียกฉันว่ากระไรนะ
I don't think there's anything wrong with my ears," she started saying in an even voice while she kept her face impassive.	หูเเหืองฉันคงจะ ไม่ ได้เฟือน ไป เองหรอกนะ" เธอเอ่ย ขึ้นก่อน ด้วย เสียงเรียบๆ โดย ไม่ ได้ เปลี่ยนสีหน้าเข้ม ขึ้นหรืออ่อนลง
I tried hard to swallow the chunk of hardwood that was struck in my throat.	ข้างผมก็ ได้ แต่พยายามกลืน แรงๆ ให้ดุ้นเสมที่ราวกับ ขึ้นมาจุก อยู่ ในคอหอย ให้มัน กลับ คืนลง ไป
While she went on speaking, she freed one hand from the shirt and put her arm across her breasts merely for form's sake, it seemed, as I could still see most of her.	เธอจึงพูดต่อไป อีก พลางปลดมือข้างหนึ่ง จากแขน เสื้อ ขึ้นปิดป้องทรวง ไว้ ท่าทาง เหมือน จะพอเป้น พิธีเพราะผม ก็ ยังคงแล เห็นเธอ ได้ อยู่ เป็น อันมาก
"'Mrs B'!	"คุณบี๋... !
Don't you realise you called me the way your father does?	นี่เธอเรียกฉันอย่างที่คุณพ่อเธอเรียกฉันเชียวนะ -
My dear boy, it seems to me you're no longer a child now," she said and chuckled.	พ่อทูนหัวจิต ใจเธอนี่ เห็นที จะ ไม่ อยู่ ส่วน เด็ก เสีย แล้วละ - ฉันว่า" ว่า แล้วเธอ หัวเราะ หึ
I chuckled as well, nervously, and because of this irrepressible chuckle I began to shudder and feel my legs almost give in at the knees.	ข้างใน ใจผม ก็พลอยหึ ไป ด้วย เหมือนคนประสาท เสีย และ ก็เพราะหึนี้ ที่พลอยสรวล ขึ้นมา ใน ใจน่ะ เองที่ทำ เอาผม ชักสั่นพลิ้ว ขึ้นมา โดยเฉพาะตามแข้งขาจน หัวเข่าแทบว่า จะอ่อนปวก
My incredulity had all gone, and uncertainty turned my exultation into such delight I could hardly control myself.	ค่าที่ตอนนี้ความ ไม่นึก เชื่อมันระเหิด ไปหมด แล้ว และ ความตระหนัก แน่ แก่ ใจ ได้แปร ความปราโมทย์ ให้กลาย เป็น ความหื่นหรรษ์ ไปแทบว่า จะครองสติ เอา ไว้ ไม่ อยู่
The chunk of wood was no longer there, but I had nothing more to say to her, and all I could do was stand on trembling legs, dumb under her spell.	ดุ้นเสมในตอนนี้ ได้หลุดล่วง ไป แล้ว แต่ผม ก็หมดที่ จะพูดอะไรกับ เธอ ได้ คง ได้ แต่ ยืนแข้งขาสั่น พิศเพลินเธอ เป็นไอ้เบื้อ อยู่ ยังนั้น
I wish I could have seen myself then.	ผมเอง ก็ อยาก เห็น ตัว เอง ในตอนนั้น เหมือนกัน
My face and eyes must have betrayed my craving and she must have seen it, because she exclaimed: "Now then!	สีหน้าและนัยน์ตาคง จะกลัดมันอย่าง เห็น ได้ ชัด และเธอ ก็คง จะ เห็น ยังนั้น เพราะเธอ ได้ ขับ ขึ้นว่า "เอ๊า!
Don't stand gawking like a retarded child.	มัวแต่ ยืนอึ้งกะทึ้ง เป็น เด็ก โบราณ อยู่นั่น เอง
Come on, go wait outside so that a lady can take a shower."	ถอยออกไปรอข้างนอกก่อนซีสุภาพสตรี จะ ได้ลูบ เนื้อลูบ ตัว ได้ตามสะดวกบ้าง "
I let out a "Sure" so hoarse and fuddled it almost didn't sound like human language.	ผมเพิ่งหลุดคำว่า "ครับ " ออกมา ได้ เป็น คำแรก แต่มัน ก็แหบ แห้ง และปร่าจนแทบว่า จะ ไม่ใช่ ภาษาคน
I ducked out of the bathroom and stood leaning against the wall next to the door, which I forgot to close.	ผมถอยผลุบออกมาแล้ว ยืนพิง ฝา อยู่ข้างประตู ซึ่งผม ไม่ทัน คิด จะปิด
I managed to control some of my emotions, but let the rest run wild most gratifyingly.	พยายามตั้งสติ อารมณ์บาง ส่วน เอา ไว้ ให้จง ได้ แต่ อีกบาง ส่วน ใหญ่ๆ ผมปล่อย ให้มัน แตกเพริด ไปอย่างออกรสออกชาติ
"A retarded child" - these words of hers slightly offended me; they were the words my classmates used to tease me for being much older than they.	"เด็ก โบราณ" คำนี้ ของเธอแสลง ใจผมหยิวหนึ่ง มัน เป็น คำเดียวกับ ที่ เพื่อนนักเรียนร่วมชั้น ของผมมันชอบเรียกล้อผมเพราะ ความ เป็นนักเรียนโค่งของผม
I had no idea what she meant and didn't intend to find out, because by then my interest was on something else.	ส่วนเธอ จะหมาย ความว่ากระไรผม ไม่ทราบ ได้ และ ไม่สน ใจ จะทราบ ด้วยเพราะ ได้เลิก สน ใจ เสีย แล้ว ในตอนนั้น เอง ...
Without realising it, at one point I had turned to lean against the doorframe and was now looking at her as she bent down to scoop up water and went about pouring it over herself.	ผมไม่รู้ ตัวหรอกว่า ได้หัน ตัว ไป ยืนพิงขอบประตูแลดูเธอ ยืนก้ม เอา น้ำลูบ ตัว และหลังไหล่ ตั้ง แต่เมื่อไร
Her showering done, she stood up, turned around and saw me, and I found myself dumbstruck again.	จนกระทั่งเธอเสร็จสรรพ และ ได้เงย ตัว ขึ้นหัน มา เห็นน่ะแหละ ก็ทำ เอาผมจังงัง ไป อีก
She unfolded her satin shirt, covered her bosom with it and, holding it in place with both hands, walked to the door.	คุณบุญเลื่องคลี่ เสื้อ ยืดแพรออกทาบปิดทรวง แล้ว เดินกอดอกสองมือออกมาที่ประตู
"Enjoying the show, aren't we?"	"ช่างชอบดูเสีย จริงนะ"
she teased.	เธอออกปากเป็นเชิงสัพยอก
"What do you think will come off it, you silly child?"	"จะดู ให้มัน เป็นอะไร ขึ้นมาหือ - เด็กโง่ "
I liked the friendly way she teased me in a situation like this, and it made me love and want to thank her so much more, and there and then I opened up in a torrent of words.	ผมชอบใจ น้ำ เสียงสัพยอก เป็นกัน เองของเธอ ในสถานการณ์ เช่นนี้ และ ให้นึก รัก และขอบคุณ เธอ ขึ้นมา อีก ไม่รู้ ว่ากี่ เท่า และ ก็ตอนนี้ เองที่ ถ้อย คำของผม ได้หลั่งพรั่งพรูออกมา
I spoke at length but the message I wanted to convey to her was merely that I had not meant to intrude; if I did, it was only because I didn't know she was in there; I'd seen her taking a book upstairs and thought she'd gone to have a nap, so I went in.	ผมพูดเสีย ยืดยาว แต่ ก็คง จะ ได้ ความ แค่ที่ อยาก จะบอกว่าผม ไม่มีเจตนา จะละลาบละล้วง เข้ามา ที่ เข้ามา ก็เพราะ ไม่รู้ จริงๆ ว่าเธอ อยู่ ในหอ้ง น้ำ ผม เห็นเธอถือ หนังสือ ขึ้น ไปข้างบน ในตอนนั้น ก็นึก ว่าเธอ ขึ้น ไป หลับ แล้วจึง ได้ เข้ามา
Then I began to apologise profusely, but she cut me short, saying: "Come off it, you aren't feeling the least bit sorry, now, are you?	แล้วผม ก็ขอ โทษขอโพย และ ก็ตรงนี้ แหละที่เธอ ได้ตัด บท ขึ้นว่า " แต่เธอ ก็ ไม่ ได้ เสีย ใจอะไร ไม่ใช่หรือ
In fact, you're rather pleased about it, right?	ดีใจ เสีย ด้วยซ้ำน่ะนา....
Isn't that so?	จริง ไหม
Come, come, there's no need to blame yourself.	เอา เถอะ - อย่าตีโพยตีพาย ไปเลย ไหนๆ เธอ ก็ เห็นฉันเกือบหมด แล้ว
Well, since you've seen most of me anyway, there's something I want you to help me with.	ก็มีอะไร อยาก จะ ให้เธอ ช่วยทำสักอย่าง อยู่ เหมือนกัน
Take a shower and wash your hands with soap.	ล้างเนื้อล้าง ตัว แล้วฟอกสบู่มือ ให้สะอาดเชียวนะ
Once you're done, come and see me in the library.	เสร็จแล้ว ไปหาฉันที่ห้อง สมุด
Er- no, make that upstairs.	เอ...ขึ้น ไปข้างบน ก็ แล้วกัน
Yes, upstairs's better.	ข้างบนดีกว่า
So scrub your feet as well."	เพราะฉะนั้นจงล้าง เท้า เสีย ให้สะอาด ด้วย-- นะ "
She walked past me and away, and my gaze followed her.	เธอออกเดินผ่านหน้าผม ไป ผมแลตาม
Drops of water clung to her skin, which was as white as the core of a banana bole, and made it sparkle all over.	หยาดน้ำ เกาะ เนื้อขาวราวกับ หยวกของเธอ ให้พราว ไปหมด
The back of her shorts was soaked, forming an inverted triangle that plunged into the cleavage of her bottom.	และชุ่มกางเกง ด้านหลัง เป็นรูปสาม เหลี่ยมคว่ำแหลมลงจรดกับ ง่ามของปลีก้น
I watched her till she disappeared from sight then went hurriedly into the bathroom.	ผมแลตามไปจนลับ แล้วรีบเ เข้าห้อง น้ำ
I dared not guess what she was about to request of me, yet couldn't prevent myself from making all sorts of wild suppositions; so, instead of just washing my hands with soap, I soaped myself all over, then, still dripping, walked up the stairs.	ผมไม่กล้าเดาว่าเธอ จะวาน ให้ผมทำอะไร แต่ ถึง ยังไงผม ก็อดคาดคะเน เอา ไว้อย่างกว้าง ขวาง ไม่ ได้ ฉะนั้น แทนที่ผม จะฟอกสบู่ ให้สะอาด แต่มือผมจึงอาบ น้ำฟอกสบู่ ให้สะอาดอ้านหมด ทั้ง ตัว แล้ว เดิน ตัว เปียก ขึ้นบันได ไปชั้น บน
The situation seemed to be about to fulfil my prediction about Mrs Bunlueang, in the sense that I had tied her up to me in my mind, even though, as I already said, I had never intruded on the upper floor of the new house.	มันให้ดู จะ เป็น ใจรับ รอง คำทำนายทายทักของคุณ บุญเลื่อง เสีย จริงๆ ในข้อที่ว่าผมมีมโนกรรม อยู่กับ เธอ ทั้งที่ผมบอก แล้วว่าผม ไม่เคย ได้กล้ำ กราย ขึ้น ไปชั้น บนของบ้านใหม่
The first room I ventured into was a bedroom - beautiful, luxurious, paradisiacal and, to me, not a little aphrodisiac.	ห้องแรกที่ผม เลือกเปิด เข้า ไป เป็นห้องนอน สวยหรู น่าบรม สุข และปลุกเร้า อารมณ์ผม ยังกะอะไรดี
At first, I thought I had come to the right place, because this couldn't possibly be Master Khajorn's bedroom, but there was no Mrs Bunlueang waiting in it.	ทีแรกผมนึก ว่าผมมา ถูกที่ แล้ว เพราะมันต้อง ไม่ใช่ห้องนอนของคุณ ขจร แน่ๆ แต่ทว่า ในนั้น ก็หา ได้มีคุณ บุญเลื่องรอ อยู่ ไม่
She was in another room in which she slept or sat in privacy whenever she felt like it.	เธออยู่ อีกห้องหนึ่ง ซึ่งใช่ เป็นที่รโหฐานสำหรับ นั่งๆ นอนๆ เป็นงานอดิเรกประวัน
The room had many doors and windows, all opened wide.	เป็นห้อง ซึ่งมีประตูหน้าต่างเปิด โล่งโถง อยู่มากมาย เสีย จริงๆ
She laid prone but slightly at an angle on a long rattan couch, her face cushioned by one arm.	เธอนอนค่ำตะแคงหน้า หนุนท่อนแขน อยู่ที่เก้าอี้หวายยาว
I didn't quite dare yet gaze greedily at the exposed parts of her body and whether out of my instinct of survival or sense of guilt, my eyes swept through the various doors and windows and I was relieved to find that nothing could be seen from the surrounding houses, and from the main house in particular.	ผมยัง ไม่มี แก่ ใจ จะตะกลามตาจาบจ้วงท่อนกาย ส่วนที่ล่อนจ้อนของเธอ ในทันทีหรอก และ จะ เป็น ด้วยสัญชาตญาณระแวงภัย หรือ เป็น ด้วย ความพิรุธ ใน ใจ ก็ ไม่ทราบ ได้ ผม ได้ กวาดนัยน์ตาเล็งแลออก ไปตามประตูหน้าต่างทุกช่องบรรดามี แล้ว ก็ เป็นที่ สบาย ใจ ได้ว่าทุกช่องทาง เหล่านั้น อยู่ ใน มุมที่อับสายตาจาก เรือนหลัง อื่น... โดยเฉพาะจากบ้านหลัง ใหญ่
I wasn't aware she was watching me until I heard her asking me drowsily: "Are you worried about my body on my behalf, young man?"	ผมไม่รู้ หรอกว่าเธอแลดูผม อยู่จนกระทั่ง ได้ยิน เสียงง่วงๆ ถาม ขึ้นมา " เป็นห่วง เนื้อ ตัว แทนฉันหรือ - พ่อจัน"
Dumbstruck, I walked up to her and kneeled down beside the rattan couch, next to her naked body.	ผมพูดไม่ออก ได้ แต่กราน เข้า ไปคุกเข่าลงข้างเก้าอี้หวาย และข้างท่อน ตัวที่ เปล่าเปลือยของเธอ
My eyes must have been feverishly active though, because I saw her looking at them and smiling teasingly, before she turned her head in the general direction of a small table at the top of the couch.	ลูกตาของผมมันคงจะขมีขมัน เอาการ เอางาน เป็นบ้า เพราะ เห็นเธอมองตาผม แล้วยิ้ม หวัว เป้นเชิงสัพยอกก่อนที่ จะพยักพเยิด ไปทาง โต๊ะเล็กที่ หัวเก้าอี้
"Please take some ice in that bowl to rub my back with."	"ช่วย เอาก้อน น้ำ แข็ง ในขันนั้น ถูหลัง ให้ที เถอะ "
I got up and fetched the metallic bowl, chose a chunk of ice that fitted my hand and placed its smoothest side on her firm, pulpy back, which I went about stroking at length.	ผมลุกไป หยิบ เอามันมา ทั้งขันลงหิน เลือก เอาก้อนที่เหมาะมือ และ เอาทาง ด้านที่เรียบที่ถู ไปตาม เนื้อหลัง อัน อิ่มอวบ และหนั่นของเธอ
She complained about the bathtub she had ordered but was still waiting for and said that as soon as it arrived, she meant to lie immersed in it for ages.	เธอบ่นเรื่องอ่างอาบ น้ำที่ สั่ง เอา ไว้ แต่ ยัง ไม่ ได้มาสักที และบอกว่าถ้า ได้มา แล้วเธอ ตั้ง ใจ จะลง ไปนอนแช่ น้ำ เล่น ให้ชุ่ม ยังไร
Almost all of her personal items such as clothes, shoes and miscellaneous accessories, including books, she bought on order.	ของใช้ของเธอล้วน แต่ เป็นของ " สั่ง" มาแทบ ทั้งนั้น ไม่ว่า จะเป้น เสื้อ ผ้า รอง เท้า ของ ใช้กระจุกกระจิก รวม ทั้ง หนังสือต่างประเทศ ด้วย
At first, I wondered which shops she ordered them from, because deliveries were seldom on time.	ทีแรกผม ก็ ไม่ เข้า ใจว่าเธอ สั่งจาก ห้าง ไหนร้าน ไหน มัน ถึง ได้ ไม่ค่อย จะมาทัน ใจ
I learned later that everything came from Penang and Singapore.	ภายหลังผมจึงทราบว่าเป็นของ สั่งมาจากปีนัง และสิงคโปร์
After complaining for a while, she closed her eyes, allowing me to concentrate on her back to better effect and wider wandering.	เธอพูดบ่นอยู่สักครู่ แล้ว ก็ หลับตา นิ่ง ไป ปล่อย ให้ผม ใจจด ใจจ่อ อยู่กับ แผ่นหลังของเธอ ได้ ถนัดถนี่ และฟุ้งสร้าน ได้ดียิ่ง ขึ้น
At first I used only one hand rather daintily, not daring to let it touch her skin, a privilege I left to the piece of ice.	แรกผม ก็ ใช้มือเดียวอย่าง หยิบโหย่ง โดยที่ ไม่ค่อย จะกล้า ให้มือ ถูกต้อง เนื้อ ซึ่งก้อน น้ำ แข็งดู จะมีสิทธิ เต็มที่ อยู่ตามลำพัง
But when the ice began to melt, I decided to use my other hand to wipe the trails of water, and when the hand that held the ice went numb with cold, I changed hands and kept alternating their respective tasks.	ครั้นน้ำ แข็งละลายเนืองนอง ผมจึง เอา อีกมือ ช่วยปาดเช็ด ให้ พอมือที่กุมก้อน น้ำ แข็ง ชัก จะ เย็นชา ผม ก็ ให้มันสลับหน้าที่กัน เสียที
After three chunks of ice had melted away, the hand that wiped the water slid down to one of her breasts, which bulged out on either side of her from the weight of her body.	และพอ น้ำ แข็งหมด ไป ได้สักสามก้อนมือข้างที่ทำหน้าที่ปาดเช็ด ก็ ไล่ลง ไป ถึงเตงเต้าที่ล้นปรี่เพราะ ถูกทับออก ทั้งสองข้าง ตัว
Though my hand was frozen, the touch was like a jolt from heaven.	แม้มือ จะ เย็นชา มันก้รู้ สึก ได้ ถึงสัมผัส อันราว ได้กับ กระทบของทิพย์
Finally, I couldn't stand it any longer.	ท้ายที่สุดผม ก็ เหลือที่ จะทนทานต่อ ไปไ-ด้หวัด ไหว
I pulled out and tightly clasped her back on both sides.	ผมยั้งมือเอา ขึ้นกำ ไว้ เหนือหลังของเธอ ทั้งสองข้าง
I knew what would happen to my body if I persisted in touching and watching her for just a little longer.	ผมรู้ตัวว่าถ้า ขืน แต่ะต้อง และพิศดูเธอต่อ ไป อีกนิดเดียว อะไรมัน จะเกิด ขึ้น แก่สรีระของผม
I raised my clenched fists and shut my eyes tight.	ผมยกมือขึ้นกำ ไว้ และ หลับตา แน่น
What an exquisite, tantalising torment!	มันช่างเป็นเรื่อง ทรมาทรกรรมที่แสน จะน่าติด เนื้อต้อง ใจ เสียนี่กระไร
O God Almighty!	คุณพระคุณ เจ้า ช่วย !
And you, angels!	ผีสางเทวดา !
And you, spirits of all ilk, help me!	ผีบ้านผีเรือน !...
What had happened?	มันเรื่องอะไรกัน....
