What had inspired her to allow me to see and touch every inch of her naked body?	อะไรกันที่มันดลใจ ให้เธอยอม ให้ผมแตะต้อง และมอง เห็น เนื้อ เปล่าของเธอ ได้ทุกขุมขน
But then why, on the strength of it, wasn't I inspired to dare do what I was dying to?	ก็ แล้วอะไรอย่างเดียวกันนั้น แหละ ทำไมมัน ถึง ไม่ดล ใจ ให้ผมกล้าทำอะไรลง ไปอย่างที่ ใจ อยาก ใคร่
To hell with it all!	อะไรก็ช่างมัน!
One day, maybe, if there was going to be such a wonderful day - or so did my wishful heart answer anyway.	คงจะสักวัน หนึ่ง หรอกน่ะ ถ้า มัน จะ ยังมีวัน วิเศษ ยังนี้ อยู่ต่อ ไป...นี่ เป็น ถ้อย ความที่ ใจภาวนาของผมมันตอบ เอง
I don't know how long I sat with eyes closed and fists clenched until I heard Mrs Bunlueang's drowsy voice say: "Well, Jan, that'll do for today.	ผมนั่ง หลับตากำมือ อยู่ ยังนั้น นานสักกีมาก น้อย ก็ เหลือที่ จะทราบ ก่อน จะ ได้ยิน เสียงง่วงๆ ของคุณ บุญเลื่องเอ่ย ขึ้นว่า " เอาละ - พ่อจัน วัน นี้ พอกันที
Thanks."	ขอบใจนะ "
Strangely enough, her order to stop, instead of disappointing me, made me feel overwhelmingly relieved.	น่าประหลาดที่คำบอกเลิก ของเธอ แทนที่ จะทำ ให้ผมอาลัย กลับทำ ให้ผมโล่ง ใจจนแทบ จะลิงโลด
I stood up and left the room immediately, almost before I thought of opening my eyes.	ผมลุกขึ้นออกจากห้องเดี๋ยวนั้น ทันทีแทบก่อนที่ผม จะ คิด ลืมตา เสีย อีก แล้ว กลับลง ไปข้างล่าง
I went back downstairs to sit in the library in order to calm down and enjoy digesting that most enthralling experience.	ลงมานั่งสงบสติ อารมณ์ อยู่ที่ห้อง สมุด และบดย่อยประสบการณ์ อันทรงเสน่ห์อย่างแสนมหานั้น เป็นที่เพลิดเพลิน อยู่
If I may borrow a foreign phrase to describe my state then, I was like a dog licking its wound with relish - the wound caused by the painful knowledge that, no matter how long I would stay, I wouldn't dare to do what my heart so desperately hankered for.	ลักษณาการที่มาอยู่โดดเดี่ยวของผม ในตอนนี้ พอ จะยืมสำนวน ฝรั่งมาอุปมา แบบประยุกต์ ได้ว่า เหมือนสุนัขหลบมาเลียแผลของ ตัว อยู่อย่างเอร็ดอร่อย....แผล อันเกิด จากการ เจ็บ ใจกรายๆ ที่รู้ ตัวดีว่า ถึง จะ อยู่นานต่อ ไปสัก เท่าไรกำลังนั้น ก็คง ไม่กล้าทำอะไรลง ไปตามที่ ใจ อยาก ใคร่จนเจียน จะ เสียสติ
And it was for this reason that I felt so relieved to be able to escape that torment.	และ ก็เพราะเหตุ นี้ แหละ ผมจึงแทบ จะลิงโลดที่พ้นๆ ทรมานมา เสีย ได้...
It was better than bearing it, fully aware that nothing would come out of it in the end.	ดีกว่าจะต้องทน อยู่ ไป ทั้งๆ ที่รู้ ดีว่า ปลายทางมันด้วน
In any case, I didn't forget that her parting words had left me with a comforting hope.	ถึง ยังไรผม ก็ ไม่ ลืมว่า คำบอกเลิก ของเธอ ยัง ได้ ฝาก ความหวัง เอา ไว้ ให้ เป็นที่อุ่น ขวัญ
"For today" meant that there would be another day, a wonderful day which I had a hunch would come sooner or later.	วันนี้ พอกันที... ก็ เป็น อันว่าวัน หน้า ยัง จะมี อีก วัน อันวิเศษ ซึ่งผม ให้นึก สังหรณ์ว่า จะสม ใจ เข้าสักวัน
Less than seven days went by before the second wonderful occasion came to be.	หลังจากนั้นไม่ ถึงเจ็ดวัน ก็ ถึงวัน อันวิเศษหนที่สอง
This time I was a little bit more daring.	หนนี้ผมค่อยกล้า ขึ้นเล็ก น้อย...
After four chunks of ice had melted, I told her, "Please allow me."	พอน้ำ แข็งละลาย ไป ได้สี่ก้อน แล้วผม ก็บอก "ผมขออนุญาตครับ "
She asked idly: "Allow what?"	เธอถามโดย ไม่สน ใจว่า "ขออนุญาตอะไร"
Instead of answering, I grasped the edge of the rattan couch on both sides and buried my face against her plump back, which was as cold as marble.	แทน คำตอบ - ผมวางมือลง ยึดขอบเก้าอี้หวาย ทั้งสองข้าง แล้วแนบหน้าลงกับ เนื้อหลัง อันอวบ และ เย็น ยังกะหินอ่อนของเธอ
Mrs Bunlueang jerked, then laughed and said: "Your face's real hot."	คุณบุญเลื่องสะดุ้ง แล้ว หัวเราะ ว่า " หน้าเธอร้อน เหมือน จะตาย "
I kissed her back all over without saying a word.	ผมจูบและเกลือกต่อ ไป โดย ไม่พูดจา
She let me do as I pleased for a while and then told me to go.	เธอปล่อยตามใจผมสัก พักหนึ่ง แล้ว ก็บอก ให้ผม ไป ได้
Though her tone was as even as usual, this time there was no bonding word like "today" and it made me feel deeply sorry and sad before I pulled back and left.	ถึง น้ำ เสียงที่พูด จะเรียบๆ เหมือน เช่นเคย แต่คราวนี้ ไม่มีเยื่อใยอะไรอย่าง คำว่า "วัน นี้ " อีก มันทำ ให้ผม ใจ เสีย และอาลัยอาวรณ์ยิ่ง นักกว่า จะถอน ตัวออกมา ได้
I avoided her for three or four days and even when I returned to stay with her in the library as before, I was still embarrassed and dared not meet her eyes.	ผมไม่กล้า เข้าหน้าเธอ อยู่สามสีวัน จนเมื่อ กลับ ไป เข้าห้อง สมุด อยู่กับ เธอ อีกตามเดิม ใน คืนต่อมา ผม ก็ ยัง ไม่วายเจื่อน และ ไม่ค่อยกล้าสบหน้าเธอนัก
That night, the heat was oppressive.	คืนนั้น อากาศอ้าวจัด
She kept fidgeting for a long while and finally put down her book, got up and went into the bathroom.	เธอกระสับกระส่ายอยู่ พัก ใหญ่ ที่ สุด ก็วาง หนังสือ แล้วลุกออก ไปห้อง น้ำ
A moment later, she was back, no longer wearing her thin, flower-patterned blouse.	หลังจากนั้นสักครู่ ก็ กลับมา เสื้อดอกบางๆที่สวม อยู่เมื่อกี้หาย ไป
Instead, she had retied her sarong over her bosom.	โสร่งที่นุ่งอยู่เลื่อนชาย ขึ้นกระโจมอก
Her body was wet and the cloth damp.	เนื้อ ตัว เปียก และชุ่ม ผ้า
She didn't resume her reading, but told me to follow her upstairs.	เธอไม่ ได้ กลับมา อ่าน หนังสือต่อ เธอมาบอก ให้ผมตามเธอ ขึ้น ไป
"Don't turn off the light," she instructed and left without waiting for me.	"ไฟเปิด ทิ้ง ไว้อย่างนี้ แหละนะ" เธอ สั่ง เสีย แล้วผละ ไปก่อน
I was so excited I hardly knew what to do.	ผมตื่น เต้น เสียจนเงอะงะแทบ จะทำอะไร ไม่ ถูก
I walked into the events that followed as if I were sleepwalking.	และผ่าน เข้า สู่เหตุ การณ์ ต่อ ไปนั้น เหมือนคนละเมอ
She was lying prone with her face on her arm as usual, waiting for me.	เธอนอนคว่ำเอาหน้า หนุนท่อนแขนรอ อยู่อย่างเคย
Her sarong was now almost down to her coccyx, leaving her white, tapering back exposed.	โสร่งที่เปิดหลังขาวฉ่อง ไว้ ให้นั้น ร่น อยู่เกือบ ถึงก้นกอย
This time, after more than half of the first piece of ice had melted, I made it slip out of my hand and it went to nestle beneath one of her breasts.	หนนี้พอ น้ำ แข็งก้อนแรก ละลาย ไปกว่า ครึ่ง ผม ก็ทำมันหลุดลื่น เข้า ไป ใต้ทรวงข้างหนึ่ง ของเธอจน ได้
She raised herself up a little to allow me to retrieve it, but my hand deserted its task instantly to grab hold of warm flesh in a greedy grope.	เธอเผยอตัว ให้ผมตาม เอา คืน แต่มือข้างนั้น ของผมมัน ทิ้งงาน เสียกลางคัน และกอดกุมเธอ ไว้ เต็มกำ
At the same time, I was slobbering all over her back and outpouring all that was hidden in my heart.	พร้อมกันผม ก็จูบเกลือกหลังเธอ อีก และรำพัน ความ ใน ใจออกมาอย่างหมดเปลือก
She let me do as I wanted for a while, like she had the first time, and then - at first, I thought she was struggling to free herself, but she was merely turning to lie on her back to have a full view of me.	เธอปล่อยตามใจผมครู่หนึ่ง เหมือนคราวก่อน แล้ว... ทีแรก ผมนึก ว่าเธอดิ้นรน แต่ที่ จริงเธอขยับ ตัวเพื่อ จะพลิกหงาย ขึ้น แล้วมองผม เต็มตา
Her face looked at once fearful and serene.	สีหน้าของเธอเหมือนนางพรายกับ แม่พระระคนกัน
From then on, I was even more of a sleepwalker.	...จากนั้นผม ก็ยิ่ง เหมือนคนละเมอหนัก ขึ้น อีก
Everything that happened before my eyes became blurred and, at first, left me no chance to recover my composure.	เหตุการณ์ มันผ่านหน้าตาของผม ไปอย่างรัวราง เต็มที จนผม ไม่มี โอกาส จะ ตั้งสติ อารมณ์ ได้เลย ในหนแรก
I only knew that I was mingling with heaven.	ผมรู้แต่ว่าผมกำลังคลุกคลี อยู่กับ ฟ้าสวรรค์
The part I remember most vividly was when- Has it ever happened to you?	และตอนที่จำ ได้แม่นยำยิ่ง นัก ก็คือ...คุณ เคย ไหม
being jolted by a searing pain as you slide your foot into a shoe and a scorpion stings your big toe?	ตอนหยิบรอง เท้ามาสวม พอสอดสวม เข้า ไป ก็ ถึง แก่สะดุ้งวาบ ไป ทั้ง ตัวเพราะโดนแมงป่องมันต่อย หัวแม่ เท้า เอา ปวดแปล เข้า ไป ถึง ไหนต่อ ไหน
The jolt I received from Mrs Bunlueang's sting was of the same magnitude, except that it resulted in no end of amazement and delight.	ของคุณบุญเลื่อง ก็ต่อย เอาผมสะดุ้ง ไป เหมือนกัน ต่างกัน แต่ เป็น ความสะดุ้งเพราะอัศจรรย์ ใจ และเอมโอ เสียนี่กระไรเลย
When I had followed her upstairs, it was about eleven at night, and when I returned alone to the soft light of the library it was about two in the morning.	เมื่อตอนที่ผมลุกขึ้นตามเธอ ขึ้น ไปข้างบนนั้น เป็น เวลาราว ห้าทุ่ม และเมื่อผม กลับลงมาหาแสง ไฟเปลี่ยวๆ ในห้อง สมุด อีก ครั้ง หนึ่ง ตามลำพังนั้น เป็น เวลาตีสอง
Thoroughly perplexed and gratified as I was, I kept wondering whether it hadn't all been a dream, even though it was still so vivid to my eyes and tangible to my body.	ทั้งที่ ก็แสน จะอ่อน ใจ และปลาบปลื้ม อยู่ ยังกะอะไรดี ผม ก็ ยังอดถาม ตัว เองซ้ำๆ ซากๆ อยู่ ไม่ ได้ว่า ฝัน ไปหรือ เปล่า ทั้งที่ ก็ ยังติด ตัว และติดตา อยู่เลย -
I kept suspecting that every feature of her whole body, nearly every nook and cranny I had seen and touched just now after having dreamt of it for years, was but a figment of my imagination.	ลักขณาของสรรพางค์เธอ แทบว่าจะทุกขุมขนที่ ได้สัมผัสมาหยกๆ หลังจากที่ใฝ่ ฝันมา เป็น แรมปีผม ก็ ยังอดระแวง ไม่ ได้ว่า เป็น ความ ฝันหรือ เปล่า
By the time I recovered my calm enough to be certain of where I stood, it was past three in the morning.	กว่าผมจะสงบอกสงบ ใจลงจนทำ ความตระหนัก แน่ แก่ ใจ ได้ เวลา ก็ล่วง เข้าตีสาม
I got up, closed all the windows, turned off the light, then left the room, closed the door and made straight through the trees for home.	ผมลุกขึ้นจัด แจงปิดหน้าต่างจนหมด และดับ ไฟ แล้วออกมาปิดประตูหน้าห้อง จากนั้น ก็ออก เดินลัดเลาะสุมทุม กลับ ไป เรือน
As I reached the staircase leading to my room, I suddenly remembered an important scene, and only then did I understand its full significance.	และ ไปจน ถึงหน้าบันได จะ ขึ้น เรือน อยู่ แล้วผมจึง ได้นึก ถึงภาพการณ์ ตอน สำคัญตอนหนึ่ง ขึ้นมา ได้ และเพิ่ง จะ เข้า ความหมายของมัน ได้ ถนัดถนี่ ในตอนนี้ เอง...
My legs felt so weak I had to sit down on the steps.	ผมถึง แก่เข่าอ่อนจนต้องทรุดลง นั่งกับ ขั้นบันได
Before I left her room, I had turned to have a last look at her.	ตอนนั้น...ก่อน จะออกประตูจากเธอมา ผม ได้เหลียว ไปมองเธอ เต็มตา อีก ครั้ง
Her milky white body was still stretched languidly on the rattan couch.	เรือนกาย ซึ่งขาว เหมือนหยวกของเธอ ยังคงทอดระทวย อยู่กับ เก้าอี้หวายนั้น เอง
Right then, she opened her eyes and held my gaze.	เธอลืมตา ขึ้นสบกับ ผมพอดี
She burst into a smile as if to give me the friendliest greeting in the world.	และยิ้ม แย้ม เหมือนทักทายอย่างกัน เองที่ สุด ในโลก
Then and there I was choked up with a rapturous emotion so priceless and intense I couldn't possibly keep it to myself.	บัดนั้นเองผม ก็บังเกิด ความรู้ นสึกตื้นตัน ใจ ขึ้นมาอย่างใหม่ เอี่ยมเป้น ความรู้ สึกที่มีคุณ ค่า และ แรงกล้าจน สุดที่ จะ เก็บงำ เอา ไว้คนเดียว ได้
I went back to her, knelt down by her couch, raised my joined hands and prostrated myself onto her generous bosom, which was soaked in sweat.	ผมหวนกลับ ไปหาเธอ คุกเข่าลงข้างเก้าอี้ของเธอพนมมือ ขึ้น แล้วกราบลงกับ เนินอก อันพูนสล้าง และ ซึมเหงื่อของเธอ
"Oh dear!" Mrs Bunlueang moaned, and hugged my head.	คุณบุญเลื่องออก เสียงครางว่า "โธ่ ..."
I embraced her body tightly and tears came to my eyes from a sweeping feeling of contentment.	แล้วกอด หัวผม ไว้ข้างผม ก็กอด ตัวเธอ ไว้ แน่น และรำๆ จะ น้ำตาไหล เสีย ให้ ได้ ด้วย ความ อิ่มเอิบที่ถั่งท้น ขึ้นมา
Then I heard her whisper: "You know-let me tell you something - I've been thinking of leaving your father - He - that is, I - But now, I don't think so any longer - thanks to you.	แล้วผม ก็ ได้ยิน เธอกระซิบกระซาบว่า "รู้ ไหม... จะบอกอะไร ให้...ฉันกำลังนึก จะเลิก กับ คุณ พ่อเธอ อยู่ แล้ว... เขา...ฉัน... แต่นี่ฉันเลิก นึก ยังนั้น แล้วละ...เธอ ช่วยฉัน ไว้มากทีเดียว...
You're a young man now, a real man, you understand?	เธอเป็นหนุ่ม แล้ว เป็น ผู้ ใหญ่ แล้วรู้ ไหม...
Now, I have to rely on you..."	เธอต้องเป็นที่พึ่ง ให้ฉันนะ...
As I recalled her words, I felt stunned: had I been slow in making a move, Mrs Bunlueang may well have left before I could fulfil my dream!	นึกถึง ถ้อย คำของเธอ ขึ้นมา ในตอนนี้ ผม ก็ ใจหาย นี่ถ้า ผมตัด สิน ใจช้า ไป เธอ ก็อาจ จะ ไปจากที่นี่ เสียก่อนที่ผม จะทัน ได้สมปรารถนา
She hadn't told me why she was thinking of leaving His Lordship, but I already knew, and I had steadfastly committed myself to make good her hope of relying on me, because I was already determined to repay my debt of gratitude to her with my life.	เธอไม่ ได้บอก ถึงสาเหตุ ที่ คิด จะเลิก กับ คุณ หลวง แต่ผม ก็รู้ ดี และ ได้รับ ปากกับ เธอ ไว้ เป็นมั่น เหมาะ ในเรื่อง ที่เธอหวัง "พึ่ง " ผม เพราะผม เอง ก็ ตั้ง ใจ จะสมนาคุณ เธออย่างถวายชีวิต อยู่ แล้ว
For all that, I came to realise how close I had been to losing the opportunity of knowing her in this life, and this is why I was feeling weak-kneed.	ถึงกระนั้น ผม ก็เพิ่ง จะ ได้สำนึก ขึ้นมา จริงๆ จังๆ เดี๋ยวนี้ เองว่าเกือบ จะคลาดกับ เธอ เสีย แล้ว ในชาตินี้ ก็นี่แหละที่ทำ เอาผม ถึง แก่ หัวเข่าอ่อน
That night, my thoughts were such a jumble that I couldn't sleep.	คืนนั้น ผมฟุ้งซ่าน เสียจนนอน ไม่ หลับ
The next day, I was informed by the district office that my name was on the conscription list and on such-and-such a year I'd be drafted into the army.	และรุ่ง ขึ้นผม ก็ ได้รับ แจ้ง จากทางอำเภอว่า ผม ได้ ขึ้น อยู่ ใน ทะเบียน ทหาร แล้ว และ อีก เท่านั้น เท่านี้ ปี ผม จะต้อง ไปรับ การ เกณฑ์
That's how I remember I was seventeen when I passed through the triumphal arch with masculine pride, as signed and certified by Mrs Bunlueang.	เพราะอย่างนี้แหละผมจึง ได้รู้ และจำ ได้แม่นว่าผมอายุ ๑๗ บริบูรณ์ แล้ว ในตอนที่ ได้ลอดประตูชัยอย่างสมศักดิ์ศรีของบุรุษ เพศ โดยมีคุณ บุญเลื่อง เป็น ผู้รับ รองอย่าง แข็งขัน
